{
  "$schema": "https://json-schema.org/draft/2020-12/schema",
  "$id": "https://tritrack.dev/schemas/aligned-transcript-v1.schema.json",
  "title": "TriTrack cue-addressed aligned transcript v1",
  "type": "object",
  "additionalProperties": false,
  "required": [
    "schemaVersion",
    "alignmentProfileId",
    "sourceBundleSha256",
    "revisionSha256",
    "language",
    "takes"
  ],
  "properties": {
    "schemaVersion": {"const": "tritrack.aligned-transcript/v1"},
    "alignmentProfileId": {"const": "cue-addressed-v1"},
    "sourceBundleSha256": {"$ref": "#/$defs/sha256"},
    "revisionSha256": {"$ref": "#/$defs/sha256"},
    "language": {"type": "string", "pattern": "^[a-z]{2,3}$"},
    "takes": {
      "type": "array",
      "minItems": 1,
      "items": {"$ref": "#/$defs/take"}
    }
  },
  "$defs": {
    "sha256": {"type": "string", "pattern": "^[0-9a-f]{64}$"},
    "cue": {
      "type": "object",
      "additionalProperties": false,
      "required": [
        "cueId",
        "startMs",
        "endMs",
        "text",
        "disposition"
      ],
      "properties": {
        "cueId": {"type": "string", "pattern": "^cue-[0-9]{6}$"},
        "startMs": {"type": "integer", "minimum": 0},
        "endMs": {"type": "integer", "minimum": 1},
        "text": {"type": "string", "minLength": 1},
        "disposition": {"enum": ["original", "revised"]}
      }
    },
    "take": {
      "type": "object",
      "additionalProperties": false,
      "required": ["takeId", "sourceSha256", "status", "cues"],
      "properties": {
        "takeId": {
          "type": "string",
          "minLength": 1,
          "maxLength": 255,
          "pattern": "^[^/\\\\\\r\\n]+$"
        },
        "sourceSha256": {"$ref": "#/$defs/sha256"},
        "status": {"enum": ["completed", "empty"]},
        "cues": {
          "type": "array",
          "items": {"$ref": "#/$defs/cue"}
        }
      },
      "allOf": [
        {
          "if": {"properties": {"status": {"const": "completed"}}},
          "then": {"properties": {"cues": {"minItems": 1}}}
        },
        {
          "if": {"properties": {"status": {"const": "empty"}}},
          "then": {"properties": {"cues": {"maxItems": 0}}}
        }
      ]
    }
  }
}
